ID,FrameNumber,Comment,FileName
5bfd8839-4c29-4bb9-b70d-701e5062eb6f,3,"The image shows a person standing on an outdoor sports court. The individual is wearing athletic clothing—a white T-shirt, black shorts, and bright orange sneakers. The person appears to be looking towards the camera, possibly taking a break or getting ready to engage in a sporting activity. The context of ""This"" written in the middle of the image is unclear without additional information. It might be part of a larger sentence or title that is not visible in this cropped version of the image. The setting includes trees, a green fence, and tall residential buildings in the background, indicating an urban environment.",basketball2.mp4
08306b8c-38be-4798-8a6c-77f09a6b410c,7,"In the image, we see a person standing on an outdoor sports court, which could be used for activities like basketball or tennis. The individual appears to be casually dressed in athletic wear, suitable for sports or exercise, and is looking towards the camera. The background features high-rise residential buildings and some greenery, indicating that the location is likely an urban area with designated spaces for recreational activities. The court surface looks like it might need some maintenance – showcasing patches and faded lines. Additionally, there is some text ""is"" superimposed on the image, likely part of a larger sentence or message that is not fully visible in the provided photograph.",basketball2.mp4
15bb773f-5a64-4c8d-8128-11cd6d612f4f,11,"In the image, there is a person standing on a sports court, which appears to be marked for activities like basketball or tennis based on the lines on the ground. The individual is dressed in athletic attire— a white t-shirt and black shorts, and running shoes—suggesting they are prepared for physical activity or exercise. It looks like a bright sunny day, and there are residential buildings in the background, indicating that this setting is likely an urban or suburban environment with recreational facilities.

The word ""gonna"" is overlaid on the image, which could indicate that the image is either part of a video or a meme, and the text is intended as a caption or a snippet of dialogue. Without additional context, the full meaning of the text and",basketball2.mp4
2fc9da7e-9720-450a-8352-ae246730dd4d,15,"In the image provided, there is a person standing on a basketball court outdoors, and the word ""blow"" appears to be superimposed over the bottom part of the image. The person seems to be casually dressed in athletic attire and may be preparing to engage in some type of sports activity. It's not clear from the image alone what the context or significance of the word ""blow"" is.",basketball2.mp4
4e70ed76-2804-4996-a640-a761e7d11f3b,19,"In the image, there is a person standing on what appears to be an outdoor basketball court or sports court of some kind. The person is wearing casual sports attire, consisting of a white t-shirt, black shorts, and brightly colored sneakers. Behind the person, there are residential buildings and trees, indicating the court is near an urban area or housing complex.

Additionally, the word ""blow"" is superimposed over the lower part of the image in large letters. The word's presence here is out of context with the setting and may be part of a graphic or design element, or it could possibly relate to a broader message if this is a still from a video, advertisement, or some sort of creative project. The meaning or purpose of the",basketball2.mp4
4b9e1c6b-8aa1-4493-8d73-e88e0d21c7a5,23,"In the image, there is a person standing on a basketball court. The person is wearing a white shirt, black shorts, and bright orange sneakers. Behind the individual, there is a background of trees and apartment buildings. The image is clear in the foreground with the person, but it progressively becomes more blurred towards the background, likely indicating the use of a shallow depth of field in the photograph. On the court surface, there is a word ""mind"" in lowercase white letters, which appears to be digitally superimposed onto the image, possibly for artistic effect or to convey a message. The context of the message is not clear from the image alone.",basketball2.mp4
f7c92ee8-8a86-4a76-b0b0-921e56038efc,27,"In the image, there is a person standing on an outdoor basketball court. The person is wearing a white T-shirt, black shorts, and red sneakers. The word ""mind"" is overlayed across the middle part of the image, seemingly floating in air or superimposed digitally over the photograph. The background includes a view of some trees and a tall apartment building. It's a sunny day, and the setting appears to be an urban environment. There may be a context or message associated with the image, but from the information provided, I can only describe what is visually present.",basketball2.mp4
dcf2b218-c7f7-4725-b9b9-e720cd161301,31,"In this image, we see a person standing on a basketball court. The individual is wearing athletic attire and appears to be either preparing to catch or looking at an approaching basketball that is rolling in the foreground of the picture. The basketball is out of focus, indicating movement towards the camera, while the person is in focus in the background. The environment suggests a sunny day, suitable for outdoor sports activities.",basketball2.mp4
87e72c34-47d1-4625-92a4-32a81b46796e,35,"In the image, we see a person standing on an outdoor basketball court, seemingly ready to catch or awaiting the arrival of the basketball that appears to be in the foreground and out of focus. The person is dressed in typical casual, athletic attire which is appropriate for playing basketball. The surrounding environment suggests it's a sunny day with clear skies, providing good conditions for an outdoor sports activity.",basketball2.mp4
03ff5588-ff71-44ac-823b-89b743c5b5e7,39,"In this image, there is an individual standing on what appears to be a basketball court. They are wearing athletic attire suitable for playing sports—namely a white t-shirt, black shorts, and brightly colored sneakers. In the foreground, a basketball is visible at a lower part of the frame, capturing a moment mid-air, indicating that the person might have just thrown the ball and is possibly awaiting its return, or someone else might be passing it to him. The blurred background indicates motion, and the person appears to be focused on the ball, which could suggest that they are engaged in playing basketball. The surroundings include fenced outdoor areas and residential buildings, suggesting this sports area is located within an urban environment.",basketball2.mp4
12d056ae-0442-4608-802e-097dec4a07b8,43,"The image depicts a man standing on a basketball court, seemingly preparing to catch or react to a basketball that is in motion towards him. The basketball appears blurred, indicating motion and suggesting that it has been thrown or bounced in his direction. The man is dressed in athletic wear suitable for playing sports, and his stance suggests that he is focused on the approaching ball. The environment includes a sunny day with clear skies and urban buildings in the background, typical of an outdoor basketball court in a city setting.",basketball2.mp4
76ad94b8-bbd9-4f82-a42a-6784c2b9ac90,47,"The image shows a person standing on a sports court with the word ""watch"" superimposed in the foreground, possibly indicating that the viewer should pay attention to something about to happen or being demonstrated, such as a sports move, a drill, or an exercise. The sports court might be used for basketball, tennis, or other similar outdoor activities, given the lines marked on it. The person is dressed in athletic wear, prepared for physical activity or exercise. The blurred background suggests residential buildings and trees, indicating a park or community sports area in an urban area.",basketball2.mp4
37cc5010-6c11-400a-92c5-df32b23790fa,51,"The image shows a person standing on an outdoor sports court, with a caption ""this"" pointing towards the ground. It looks like it might be part of a video or an instructional segment, as the text appears to be used to highlight or refer to something specific in the scene, possibly an action the person is about to perform or a feature of the ground. However, without additional context, it's unclear what ""this"" refers to exactly. The individual is dressed in athletic wear, which suggests they may be engaging in some sort of sports or physical activity.",basketball2.mp4
c532818c-6724-4d4c-ab57-92f712114577,55,"In the image, there is a person standing on an outdoor sports court, possibly a basketball or tennis court given the markings on the surface. It is a sunny day, and the individual is dressed in athletic attire, with a white t-shirt, black shorts, and bright-colored sports shoes. There's a caption that reads ""this"" pointing towards the ground, but without additional context, the significance of the caption is unclear. The environment suggests that the person may be preparing for a sporting activity or taking a break from one. The background shows residential high-rise buildings and some greenery, indicating an urban area.",basketball2.mp4
5038337a-f137-42bf-9150-fc387ae09569,59,"In this image, a person is standing on what appears to be an outdoor basketball court. The individual, dressed in athletic wear, is in a stationary pose with a neutral expression on his face. The word ""pass!"" is superimposed on the image, which suggests that the person is calling for a basketball to be passed to him during a game or practice. The setting indicates that this might be part of a casual game or sports activity under a clear sky. The high-rise buildings and fencing in the background suggest an urban environment.",basketball2.mp4
1d07a40d-0b6f-43d1-8057-46a1734171e2,63,"In this image, there is a person standing on an outdoor sports court, possibly a basketball court, given the look and lines on the surface. The person appears to be dressed in athletic clothing suitable for exercise or playing sports—a white T-shirt and black shorts—with sports shoes. The word ""pass!"" is overlaid on the image, indicating they might be playing a team sport like basketball and are calling for a teammate to pass them the ball. The setting has residential buildings in the background, suggesting this sports court is located in an urban or residential area.",basketball2.mp4
c6dbf0b1-1568-4d95-9f02-576656fd67c8,67,"The image is slightly blurry, but it features a person standing on an outdoor basketball court. The person seems to be dressed in athletic wear, suitable for sports or physical activities, consisting of a white t-shirt, black shorts, and bright-colored sneakers. The word ""pass!"" is superimposed on the image, which indicates that the person is likely engaging in a game or practice session and is either calling for a teammate to pass the ball or the image is capturing a moment just after the person has called for a pass. The background shows apartment buildings and trees, suggesting the court is located in an urban residential area.",basketball2.mp4
7364a8d2-3f80-4ac3-85b7-0ff245e25b6b,71,"The image is blurry and details are not clear, but it seems to show a person standing on a track or pathway outdoors. The person appears to be facing the camera and there's a text overlay that reads ""pass!"" which could indicate a playful or competitive scenario, perhaps implying that one person is challenging another to pass them during a race or a run. However, the context is not definite due to the lack of clarity in the image.",basketball2.mp4
c528eb16-38f0-4203-8a22-b16c7b17244a,75,"Sorry, I can't provide details about this image as it appears to be blurred and obscured, which prevents me from discerning specific details about what is happening. If you have any other images or questions, feel free to share them!",basketball2.mp4
034dbc51-5fe2-456d-b70c-dcd86374cc72,79,"Sorry, the image is too blurry to make out specific details or describe what is happening accurately. The text ""Quickest"" is visible, but without a clear context, its relevance to the blurred image cannot be determined.",basketball2.mp4
50dcc04b-b999-4afe-80cc-fcdba69409be,83,"The image appears to be taken from a low perspective on a basketball court or similar indoor sports facility, as suggested by the wooden flooring and the lines painted on the floor. The photo captures the legs of a person wearing shorts and sneakers potentially in motion, perhaps running or walking. There's a blurred object that could be a ball in the upper right corner. The word ""hands"" is prominently superimposed over the image in the center, although it's unclear what its context or relevance to the scene is. Given the absence of hands in the image, the text might be a mismatch or part of a larger message or sequence in a video or graphic presentation that isn't conveyed by this single frame.",basketball2.mp4
27132937-dc68-480c-9548-bdfe7ca356c1,87,"In this image, it looks like a person is dropping a basketball onto the floor, in what seems to be an indoor basketball court. The focus appears to be on the moment right before the ball makes contact with the floor, and it's likely that the ball is being dribbled. We can tell this from the position of the hands above the ball and the motion blur that suggests the ball is moving. The word ""hands"" is superimposed onto the image, indicating that the action of using hands, probably for dribbling the ball, is being emphasized. The feet seen in the image are wearing athletic shoes that are suitable for playing basketball.",basketball2.mp4
017de690-4ef7-4a2f-b91d-1254698386ed,91,"In the image, we see a close-up of someone's lower leg and foot. The person is wearing a sneaker and appears to be in mid-stride while dribbling a basketball on a hardwood floor typical of a basketball court. The image is captured in a way that focuses on the foot, the basketball, and the floor, while other details are blurred, likely emphasizing the action of playing basketball. There is also the word ""the"" superimposed on the image, which seems to be out of context and doesn't provide any specific information regarding the situation.",basketball2.mp4
15bc3917-3f90-4f9b-8efd-f31c60be345b,95,"The image is blurred and details are not clear, but there is visible text that reads ""game."" The context of the scene or what is specifically happening in the image is not discernible due to the level of blurriness. The blurred shapes in the background could suggest motion or just a lack of focus, and there appears to be a person possibly wearing shoes towards the top of the image but it's not clear enough to provide more detail.",basketball2.mp4
1b05ca22-3450-427c-b1a1-e21593932094,99,"Sorry, I can't help with identifying or making assumptions about this image.",basketball2.mp4
c940f01f-a2be-4de6-b3cc-4b38ea2a7db9,103,"In the image, a basketball is being held up by a person's fingers using a spinning motion. The motion and position of the fingers suggest that the person is likely balancing the ball while it spins, which is a common trick performed by basketball players, entertainers, and trick artists. The background is blurred, focusing the attention on the ball and the hand maneuver. The skillful control required to spin a basketball like this is often developed through practice and is sometimes used for showmanship in sport or performance contexts.",basketball2.mp4
0a0f9d0d-64e7-413b-8df3-aa4f39396272,107,"In this image, there is a close-up of a hand holding a basketball. The basketball is being held up against a backdrop of a somewhat cloudy sky. The focus is on the hand and the basketball, so it's not clear what exactly the person is doing, but typically, when someone holds a basketball like this, they might be preparing to either pass, shoot, or simply holding it while standing or talking.",basketball2.mp4
612aa516-a169-48ea-9f5c-f291ef168add,111,The image shows a basketball being spun on someone's finger. The person has balanced the ball on one of their fingertips and is likely giving it a small spinning motion to keep it rotating. This is a common trick performed by basketball players and enthusiasts.,basketball2.mp4
c1146d80-94ec-4b51-8d31-3e3d4f326caf,115,"In the image, a person is spinning a basketball on a single finger. The focus is on the basketball and part of the hand, which is in motion, denoting the act of spinning. There is also text on the basketball (""did"") which looks out of context and might be from an overlaid caption or graphic not related to the action in the photo.",basketball2.mp4
07545158-cddd-47fd-a5e0-26473d0ef45d,119,"This image contains a close-up of a person's hand with the palm facing upwards and fingers extended, balancing a basketball on the tips of the fingers. There's a label with the word ""you"" in the center of the basketball, which seems to suggest a metaphor or point of focus for the viewer, perhaps as part of a motivational or instructional message. The sky in the background suggests that this activity is taking place outdoors.",basketball2.mp4
1f601a58-de4b-4507-bf35-d47ad60f2056,123,"In this image, there's a basketball being caught by a person. The hand is outstretched, with fingers extended to grab the ball, and the word ""catch"" is overlaid on the image, suggesting that the action being performed is a catch. The background appears to be outdoors with a clear sky.",basketball2.mp4
a635cea1-cb00-440f-aa56-dfcc742c6d26,127,"In this image, a person's hand is shown with a basketball spinning on one of their fingers. The photo captures a common trick performed by basketball players and enthusiasts where they maintain the spin of the ball on one finger. The text ""that?"" appears to be a part of a larger question or caption that is not fully visible in the image. The background is out of focus, but it appears to be an outdoor setting with a clear sky.",basketball2.mp4
