ID,FrameNumber,Comment,FileName
fd3a9001-b3df-44af-94a3-e614404fe08e,3,"This image shows a close-up of a basketball hoop with a chain net. The angle and framing focus on the hoop from slightly below, highlighting the red rim, the black backboard support, and the metal chain net. There doesn't appear to be any action happening at the moment the photo was taken, so we can't see a ball going through the hoop or any players around. The background is white and nondescript, providing no additional context.",basketball1.mp4
dc6fceb8-f59e-4626-9054-3808059fa10d,7,"This image displays a close-up view of a basketball hoop with a chain net. The background is plain and does not offer much context, but the focus of the image is on the metallic chain links of the net and the red rim of the basket, attached to the backboard. There isn't any action apparent in the still image—no ball or players in sight—so we're seeing just a stationary aspect of a basketball goal.",basketball1.mp4
505dc9da-193d-4f75-bdc4-f17a8161c259,11,"The image shows a close-up of a basketball hoop with a chain net. There is no ball or human activity visible in the image. The angle of the image is from below, looking up towards the hoop and net against a plain, light background, which could be the sky or a wall. The hoop and net appear to be in good condition, and the red color of the basketball hoop rim provides a contrast with the metallic color of the chain net and the light backdrop.",basketball1.mp4
d194d1cd-a83a-4922-be30-9f2d424cb7c3,15,"In the image, you can see a close-up of a basketball hoop with a chain net. The perspective is from below the hoop looking up, with the focus being on the rim and the chain net attached to it. There's no basketball or players visible in the frame, so the image is capturing a still moment without any active play. The background appears to be a plain, clear sky. The hoop itself has a red color. This type of chain net is often used for outdoor basketball courts as it is more durable than the traditional nylon nets, particularly in variable weather conditions.",basketball1.mp4
5ba842d5-7bfd-4326-b70b-970392de7212,19,"In this image, a basketball is going through the hoop of a basketball goal. The hoop has a chain net, which is less common than the traditional nylon nets but can be found on some outdoor basketball courts. The ball is in the process of falling through the net, which is typically counted as a successful field goal, scoring points for the team or player that made the shot.",basketball1.mp4
42538483-307c-463b-99e6-4c99ba02f50f,23,"The image shows a basketball net with a ball just passing through it, indicating a successful shot has been made. You can see the ball is in motion as it disrupts the net, which is typical when a ball passes through during a game of basketball. The background is fairly nondescript and seems to be an outdoor setting given the white, possibly snowy, background.",basketball1.mp4
5295f0cf-4a26-48b9-93e8-c6dcc880f9e8,27,"In this image, a basketball is passing through the hoop of a basketball net. The photo captures the ball midway through the net, and the motion of the ball's descent is emphasized by the blurred appearance of the netting. It appears to be a successful shot or a ""swish,"" where the ball goes through the hoop without hitting the rim or backboard.",basketball1.mp4
e6383c9a-bd49-443e-8602-2bedcc0dc045,31,"In this image, a basketball is going through a basketball hoop. The hoop is equipped with a chain net, which is not as common as the traditional nylon nets but can be found on some outdoor courts. The basketball has just passed through the rim and is partially through the net, indicating a successful shot or score. The background appears to be quite plain, possibly overcast sky or a white wall, making the details of the hoop and the basketball stand out clearly.",basketball1.mp4
d20de4cb-b640-44ae-a35b-2a6d08f56fe4,35,"The image is showing a close-up, blurred action shot of a basketball going through a basketball hoop. We can see the net is in motion, likely due to the force of the basketball passing through it, which indicates that a basket has been scored. The motion and blur signify that the photograph was taken at a high speed to capture the fast action of the game.",basketball1.mp4
c53df3bc-20a3-4ede-8dd2-3b1eee2a51ae,39,"Sorry, the image is too blurred to discern any specific details about what is happening. If you can provide a clearer image or more context, I would be happy to try to give you information or a description based on that.",basketball1.mp4
25797c09-bf83-4601-bf8b-382ecb75654e,43,"The image is very dark and blurry, which makes it difficult to discern the details clearly. However, it appears to be a close-up view of a basketball hoop from below, including the rim and the net. No action is captured in the image, such as a basketball going through the hoop or a player interacting with it; it's just the equipment itself. The darkness and lack of contextual elements make it hard to describe the scene further or deduce what exactly is happening beyond this observation.",basketball1.mp4
339ff285-8d1c-473e-8520-954ce26e9f6a,47,"The image shows a basketball hoop from an underneath perspective. It's difficult to discern any action such as a ball going through the net or players interacting as the image is tightly cropped on the hoop. The setting appears to be indoors, likely a basketball court, as implied by the hoop, the net, and the structure of the ceiling. No players, ball, or additional context is visible in this image.",basketball1.mp4
3bedc964-969f-44d4-9af3-10be79b0900c,51,"The image shows a basketball hoop from a perspective beneath the rim, looking up towards the net and backboard. The photo captures the hoop in a stationary moment, with no visible action like a basketball going through the net. The environment appears to be indoors, as suggested by the dark background and the structure above the hoop, which could be the ceiling or supports inside a gymnasium or sports facility. There's no indication of movement or a game being played in this particular snapshot.",basketball1.mp4
85315eff-2cb9-4121-a27e-7c07d7d1304b,55,"The image is of a basketball hoop, taken from beneath and slightly to the side. The viewpoint is looking upwards towards the hoop and backboard, with the focus on the rim and the net. The lighting is dim, and this gives a dramatic or slightly moody effect to the photo. There's no ball or action visible in the shot, so it's a still image of the hoop itself without any ongoing gameplay.",basketball1.mp4
b592feb2-f438-401c-85fe-38e37e3d9947,59,"The image shows a basketball hoop with a net attached to it. It looks like it's taken from below the hoop, with the perspective looking up towards the hoop and the dark ceiling behind it. However, there's no ball or player in sight, so we can't be certain if a game or shot is happening based on this image alone. It's a still image that captures the hoop and net setup typically found in a basketball court.",basketball1.mp4
9540548b-b672-4984-8189-ee3440ca2aca,63,"This image shows a basketball hoop from underneath. The perspective is upward, looking at the hoop and net, with the darkened area above suggesting it is either indoors with the ceiling being out of focus, or outdoors at night. There's no ball in the shot, so the image simply captures a static moment of the hoop and net without any ongoing action.",basketball1.mp4
ad9a54ab-9cf2-4b99-96bf-2c47a3b6d046,67,"The image you have provided shows a basketball hoop from below, with the focus on the hoop and net. There is no ball in sight and no clear indication of an ongoing game or any players. The setting appears to be indoors, as the background is dark and there are structural elements suggesting it is perhaps inside a gym or sports facility. The image is taken from a perspective directly under the hoop, looking up towards the ceiling.",basketball1.mp4
b4f402fb-5e02-4e6d-9b9d-9a3f5c666c5b,71,"This is an image of a basketball hoop, shot from below and at an angle. The hoop is attached to a backboard, and the net is hanging down from the metal rim. There seems to be a building or a dark sky in the background. The image does not show any people or action like a basketball game, so I can't provide context for what might be happening outside of the frame of the photo. The hoop is in focus, and the image appears to be taken in low lighting conditions, possibly indoors or at night.",basketball1.mp4
ff575c7b-5fa5-4968-9ab4-68794daaf17a,75,"The image shows a basketball hoop with the net attached, taken from a low angle looking upwards. It's a bit dark, which could indicate that the photo was taken indoors without bright lighting or maybe during the evening or night. There is no basketball or any action visible in the frame, so it appears to be a still image of the hoop itself without any immediate gameplay happening.",basketball1.mp4
c5ef6911-b3d4-4e7d-bbb9-d27907231a41,79,"The image shows a basketball hoop with a clear view of the rim, net, and backboard bracket from below. There is no basketball visible in the shot, so it's not clear if a game is in progress or if this is simply a static image of the hoop. The perspective is from below the hoop looking upwards, with the structure that supports the backboard visible in the dark background, which may indicate that the setting is indoors, possibly in a gymnasium or sports arena. There are no visible actions occurring in this specific frame.",basketball1.mp4
37c19b5c-c928-4f48-9fe6-0c8325706e1f,83,"The image shows a basketball hoop against a dark indoor background. We can see the metal hoop with a net attached and the backboard above. There are no basketball players or a basketball in view. The setting appears to be an indoor basketball court, as inferred from the typical structure of the hoop and backboard. Since it's quite dark, it could be a court with the lights turned off or an image taken with low lighting. There's no specific action captured in the photo—it's just a stationary shot of the equipment.",basketball1.mp4
