ID,FrameNumber,Comment,FileName
d155e699-d55a-4a73-b2b5-f63218b874b1,3,"The image shows a person on a grassy field performing a soccer trick where they're balancing the ball on the back of their neck. The individual is dressed in athletic attire, suggesting they are engaged in a sports activity, likely soccer training or practice. There is also text superimposed on the image that says ""Why"", which is unrelated to the action being performed. The background includes a clear sky and greenery, which suggests this activity is taking place outdoors on a sunny day.",soccer_player_head.mp4
5aece07a-487c-47d8-b590-03b06a9a8907,7,"In this image, there is a person playing soccer. They appear to be in the middle of juggling the ball with their head, a skill known as 'heading' in soccer. The person has their eyes closed and seems concentrated on the task, with their arms outstretched slightly for balance. The background shows a soccer field and some empty spectator stands, suggesting this could be during a practice session or a casual play outside of a competitive match. The surrounding area is green with hills, indicating a possible rural or park setting.",soccer_player_head.mp4
911d7b75-1e64-4fc2-847b-525e48db7a60,11,"In the image, a person is playing soccer (football) on a grass field. The person is in the middle of doing a 'header,' a move in soccer where the player uses their head to strike or guide the ball. The player is wearing a black shirt, blue shorts, and blue soccer socks, and their pose suggests they are concentrating on the ball above them to properly hit it with their head. In the background, we can see a grassy landscape with hills and a section of a stadium or sports complex with seats.",soccer_player_head.mp4
bd7b8e7b-2f4b-4dde-a2b3-5e591214eb50,15,"The image shows a person on a grassy field performing a soccer trick known as 'head juggling' or 'keepie-uppie' with a soccer ball. The person seems to be focused on controlling the ball with the head without letting it touch the ground. They are wearing a black shirt, blue shorts, and soccer socks with cleats, indicating that they are dressed appropriately for playing soccer. The setting appears to be a soccer field, with what looks like a seating area and trees in the background. There is an unusual symbol or text, ""90%"", superimposed over the shorts, which does not seem to relate to the activity and could either be an editing mistake or intentionally placed there for reasons not evident in the context of the image",soccer_player_head.mp4
404af88b-fe38-4bd9-ac2b-02e2de40ea78,19,"In the image, a person is engaged in a soccer-related activity, specifically practicing heading, where they are preparing to hit the soccer ball with their head. The player is wearing a black shirt, blue shorts, and blue soccer socks with shin guards, and black cleats, indicating they are dressed in athletic attire suitable for playing soccer. They are standing on what appears to be a grass soccer field with natural surroundings in the background. The presence of a ""90%"" graphic on the shorts seems superimposed and out of context with the sports activity, potentially relating to a concept or message not directly discernible from the image alone.",soccer_player_head.mp4
779f65f8-0e96-4300-8efb-d4c09acb7d36,23,"In this image, there is a person outdoors practicing football (soccer). Specifically, they seem to be working on their ball control skills by juggling the ball with their head. The person is wearing a black t-shirt, blue shorts, and soccer cleats while keeping their eyes on the soccer ball above their head. It looks like a typical soccer training session on a grass pitch, with nature and what appears to be a section of stadium seating in the background.",soccer_player_head.mp4
dc98593c-c422-44b3-b394-fd402b8e5475,27,"In this image, there's a person playing soccer. The soccer ball is in the air, and it appears as if the person has just performed a 'header'—using his head to direct the ball—or is preparing to do so. The player is dressed in athletic attire appropriate for playing soccer, including a black t-shirt, blue shorts, and blue socks with soccer cleats. The background shows a grassy field, typical of what you would find in a soccer field or park, with trees and some seating stands in the distance, suggesting this area is designated for sports activities.",soccer_player_head.mp4
35c50ee0-ba2f-40a6-a873-2736970fb83e,31,"In this image, we see an individual practicing soccer. The person appears to be performing a header, a move where a player uses their head to control, pass, or shoot the ball. They're on a grassy field with a clear sky, and it looks to be a warm, sunny day. The surrounding environment suggests they might be at a local sports field or park with seating for spectators visible in the background. The text ""soccer"" is superimposed over the lower part of the image.",soccer_player_head.mp4
5d46de29-b56e-473d-a3cc-8e1d14c0115b,35,"In the image, there is a person practicing soccer by using their head to control or play a soccer ball. The individual appears to be a soccer player engaged in the activity of ""heading"" the ball, which is a skill where players use their heads to interact with the ball, often to pass it, score, or guide it in a desired direction without using their hands. The environment suggests that this could be taking place on a soccer field, with natural scenery such as a hill and trees in the background, and a seating area that resembles a small stadium or sports complex.",soccer_player_head.mp4
80be6b3d-f171-4352-ab0c-91b9f228a750,39,"In the image, a person wearing a black shirt and blue shorts is playing soccer on a lush grass field. It appears that the individual is skillfully balancing or juggling the soccer ball with the back of their neck, a move that requires coordination and control. The player is standing upright with arms extended for balance while the ball is suspended in the air above their head. The background shows a tranquil natural landscape with green hills, indicating the playing field may be in a rural or park setting.",soccer_player_head.mp4
60967d6b-cd81-4980-978e-268e4d061593,43,"In this image, we see a person practicing football (soccer). The person has skillfully balanced the football on the back of their neck and is leaning backwards slightly to keep the ball in place. The individual is wearing a black T-shirt, blue shorts, blue socks, and black football boots suitable for playing the sport. In the background, there is a grassy field with bleachers, suggesting that this practice might be taking place on or near a football pitch. The environment looks sunny and clear, indicating good weather conditions for outdoor sports activities.",soccer_player_head.mp4
28df6207-2611-431d-85b1-c04b923d008b,47,"In the image, there is a person playing soccer (football) and skillfully juggling or controlling the ball with their chest. Their posture and concentration suggest they are focused on keeping the ball from touching the ground, using their body to do so. The background shows a typical outdoor soccer field environment on a clear day, with greenery and seating for spectators visible.",soccer_player_head.mp4
77d1dd1a-c6e6-46fb-9cf0-dd0a50faf2f9,51,"The image is quite blurred, but it appears to show a person playing soccer or football. The person seems to be in the motion of heading a soccer ball, which you can see is slightly above and in front of them. The player is wearing a black top, blue shorts, and soccer socks, which is typical athletic attire for playing soccer. The setting is an outdoor field with what appears to be greenery in the background, suggesting it might be a soccer field or a park.",soccer_player_head.mp4
c81d18b8-b223-4998-ba3c-70c7f7e59ac7,55,"The image is blurred so it's not possible to make out specific details. However, we can infer from the context that there appears to be a person in athletic wear, potentially engaging in a sport, with the word ""nail"" superimposed over the image. The blurriness of the image prevents me from providing a detailed description of the action taking place.",soccer_player_head.mp4
827972cc-33dd-493d-85c1-eab862d4e550,59,"Sorry, I can't provide details about this image because it is too blurry to accurately discern what is happening. The word ""nail"" is clearly visible in the center, but without more visual context, I cannot interpret the scene or actions taking place.",soccer_player_head.mp4
efac84e8-e6f7-4d04-943e-f21418537c2a,63,"The image is heavily blurred, making it difficult to discern specific details. However, in the bottom part of the image, there appears to be the tip of a sneaker or shoe that is in focus. In the center, there is the word “or” clearly visible against the blurred background. The rest of the surroundings are too blurred to make out precise details, but it looks like there might be a transition from a grassy area to a paved surface, perhaps indicating someone standing on the edge where grass meets pavement. The overall context or narrative of the image isn't clear due to the level of blurriness.",soccer_player_head.mp4
2570dd88-9778-4c5d-a90e-f2fe527937e1,67,"The image is intentionally blurred, making the details unclear, but it appears to show a person in a red shirt with a soccer ball positioned above their head. The text ""fail"" overlaid on the image suggests something unexpected or unintended happened, likely related to their attempt to play with the soccer ball. Since it's a still image, we can't determine the exact context or sequence of events, but the connotation of ""fail"" typically implies a failed trick, mistake, or humorous moment while playing sports.",soccer_player_head.mp4
abf08379-47f7-4085-bbd0-79f408624cbb,71,"In the image, you can see a person who appears to be playing soccer. The soccer ball is making contact with their face, which suggests they might have missed controlling the ball with their head—a technique known as ""heading"" the ball in soccer. The word ""fail"" is overlaid on the photo, indicating that this moment is being highlighted as a mistake or an unsuccessful attempt at heading the ball. The expression on the person's face and the position of their body further suggest an unintended and likely uncomfortable impact with the ball.",soccer_player_head.mp4
550f79e1-9f64-42d3-ae03-509d5737aa08,75,"In the image, you can see a person playing football (soccer), practicing a header, a skill where a player hits the ball with their head in order to control it or direct it toward a desired spot. The person is likely in training or during a match. The ball is resting on the player's head at the moment the photo was taken, and the text ""headers?"" suggests that the image is either a snapshot from a drill focusing on headers or capturing a moment where the player is demonstrating their ability to balance the ball on their head.",soccer_player_head.mp4
522d0ad2-1ae1-4ca0-b2fa-00b12b40f092,79,"The image shows a person, likely a soccer player, in mid-action of playing a header, which is a move in soccer where a player uses their head to strike or direct the ball. The ball is in contact with the player's head, and they appear focused on the play. The addition of the word ""headers?"" in the image suggests that it might be from a piece of content discussing the technique or perhaps raising a question about the action, such as its effectiveness or safety in the game.",soccer_player_head.mp4
b2eff75a-b50b-426f-b8cc-1e23bbf04a8c,83,"In this image, a person appears to be playing soccer (football) and is in the midst of performing a header, which is a skill where the player uses their head to play the ball. The soccer ball is making contact with the player's forehead, which is the correct technique for heading the ball. The person is wearing a red, wet shirt, indicating that they might be playing in wet conditions or have perspired, making the shirt stick to their body. The background is blurred, focusing attention on the action of the header, but it looks like the setting could be a stadium or a training ground. The word ""headers?"" in the image suggests that the action captured is indeed a header or it could imply that the person is practicing headers.",soccer_player_head.mp4
fa98bca0-76dd-4367-890f-1e66c682b4a5,87,"The image shows a person who appears to be playing football (soccer), performing a header, which is a move where a player uses their head to control, pass, or shoot the ball. The context seems to be casual or practice, as there are no indications of a competitive match taking place in the background. The person is wearing a red sports shirt, and the ball is making contact with their forehead. The text ""headers?"" superimposed on the image suggests that the activity of heading the ball is the focus.",soccer_player_head.mp4
bc6b03e7-7991-4992-9032-db0bbd4c93c9,91,"In the image, it appears that a person is practicing headers with a soccer ball. The ball is balanced on their forehead, indicating they may be training or demonstrating control of the ball in a static position rather than actively heading the ball as one typically would during a game. The person is wearing a red sports shirt, suggesting they might be an athlete or someone engaged in sports activity.",soccer_player_head.mp4
989161f7-fcd4-4c36-bcb2-eb8ddefe2268,95,"In the image, there is a person performing a header, which is a technique used in soccer (football) to guide the ball using the head. This movement typically occurs during gameplay to pass the ball to a teammate, clear the ball from the defensive area, or attempt to score a goal. The person is wearing a red sports shirt, and their hair appears to be somewhat wet, possibly due to sweat or wet playing conditions. The ball is in contact with their forehead, which suggests they are in the process of heading the ball.",soccer_player_head.mp4
e9c9e7e1-b65b-49af-a125-568b1a4656cc,99,"In the image, a person is performing a header, which is a technique in soccer (football) where a player uses their head to hit or direct the ball. The player is likely attempting to control the ball, pass it to a teammate, or direct it towards the goal. The word ""Header"" is superimposed on the image, indicating the action being performed.",soccer_player_head.mp4
6b8b2b87-507f-4074-86f6-12c143b6924f,103,"In this image, a person is performing a soccer trick known as ""heading"" where they use their head to control, pass, or shoot the ball in soccer (football). The ball is in contact with the person's forehead, which is the proper technique for heading the ball to avoid injury and have better control. The text ""attempt"" across the image seems unrelated to the action shown and could refer to something within a broader context not evident from the image alone.",soccer_player_head.mp4
ff8a68cf-101a-45dc-9a6c-3e16a09051b1,107,"In this image, there is an individual who appears to be practicing a soccer skill known as 'heading,' where they use their head to control, pass, or shoot the ball. The ball is positioned above the person's forehead, indicating they have either just headed the ball or are about to do so. The text ""attempt"" overlaid on the image suggests that this action is an attempt at performing the skill. The person is wearing a red shirt, and the background appears to be a sports stadium with seating, although the stands are empty.",soccer_player_head.mp4
ab9d1c9b-aac0-433b-8d3e-1bf37d609d71,111,"In this image, we see a person likely in the middle of a soccer game or practice session, with a soccer ball balancing on their head. The ball is stationary on their head and it doesn't seem like the ball is in motion—it looks like they are showing off their ball-handling skills, possibly doing a trick called 'heading' where players use their head to control, pass, or shoot the ball in soccer. The text ""incoming!"" is superimposed on the image, adding a humorous effect as if to suggest the ball is about to be played or is heading towards the player, even though the player seems to have it under control.",soccer_player_head.mp4
0f6ca0e4-a747-4c2e-ac75-a2c7e84369a4,115,"The image shows a person wearing a red shirt with a soccer ball that appears to be about to hit them on the head or neck area. The word ""incoming!"" is overlaid on the image, indicating that the ball is moving towards the person as an incoming object. The person's body posture suggests they may not be fully aware of the ball's imminent contact. The expression is comedic, hinting at an unexpected or unplanned moment during a soccer game or practice.",soccer_player_head.mp4
5d87ad8c-d297-41e8-9970-a1fbb0bdb5d6,119,"In the image, an individual is captured in the moment just before a soccer ball makes contact with their forehead, likely positioning themselves to perform a heading of the ball. The text ""incoming!"" humorously indicates the imminent contact between the ball and the person's head. The focus is on the action and skill of heading the ball, which is a fundamental part of soccer play, used to pass, clear, or score with the ball using the head. The person is wearing a red shirt, which might suggest they're a player on a team, and the background appears to be a stadium or sports arena, indicating that they could be in the middle of a practice or a game.",soccer_player_head.mp4
1ad0640f-34e0-42e4-b569-007ca09ae78d,123,"In the image, a person appears to be balancing a soccer ball on their head or neck, demonstrating a skill commonly practiced by soccer players to improve their control and touch with the ball. The individual is dressed in a red sports shirt, and the background suggests this activity is taking place in a stadium or sports field, likely during or after a practice session or match. The soccer ball looks a bit worn, indicating it has seen considerable use. The focus and concentration on the individual's face imply they are actively engaged in the task.",soccer_player_head.mp4
56478dcf-652c-443f-9bb0-756c16270681,127,"In this image, we see a person performing a football move often referred to as 'heading' the ball. The soccer ball is balanced on their forehead, and it looks like the person is either practicing or demonstrating their ability to control the ball with their head, which is a skill used in the game of soccer to pass, shoot, or redirect the ball during play. The person is wearing a red sports shirt, and there are drops of water visible around their face and the ball, suggesting that it may be raining or that they are sweating. The background is out of focus but seems to be a sports field or stadium setting.",soccer_player_head.mp4
60e2c6fb-31f5-461f-8870-90e1a5bf2a63,131,"In this image, a person is balancing a soccer ball on their forehead. It seems like an action captured during a soccer training session or while someone is showcasing their ball-handling skills. The individual is wearing a red sports shirt and is slightly leaning back to maintain the ball's balance. The backdrop suggests this activity is happening on a soccer field or similar sporting area. The ball and the person's hair are speckled with water droplets, which could indicate that it is raining or that the player has sweat from physical exertion.",soccer_player_head.mp4
2739175b-64ed-4cc8-b7ea-a82701d0fdfa,135,"It appears that a person is practicing football (soccer) by balancing a soccer ball on their forehead. The person is wearing a red shirt, and it looks like they're outside, possibly on a football pitch or in a similar open space. There's a text overlay that says ""Did,"" which is likely part of a larger message or caption that is not fully visible in this image. The focus and attention of the individual seem directed towards keeping the soccer ball steady on their forehead, which is a skill often practiced to improve control and balance in the sport.",soccer_player_head.mp4
46e4e8b1-d2cd-4ccf-8a85-e204d665ebc1,139,"In the image, there is a person balancing a soccer ball on the back of their neck. The person is wearing a red t-shirt and appears to be looking upwards, possibly focusing on maintaining the balance of the ball. The soccer ball looks used and is resting on the person's neck near the base of their head. The background is blurred, but it seems to be an outdoor setting, possibly a soccer field or a park. There is a watermark or a text fragment on the image saying ""he,"" which looks like it might be part of a larger piece of text that is not fully visible.",soccer_player_head.mp4
91ff786d-73f4-45a7-9939-460384510c80,143,"In the image, there is a man with a soccer ball balanced on the back of his neck and head, seemingly showing off his football skills. He's wearing a red shirt that is visibly dirty, suggesting he may have been playing on a grass or dirt field. The image is static, and it is not clear whether he is in motion or holding the pose, but such control of the ball typically indicates a level of skill and practice in handling a soccer ball. The word ""score?"" is prominently displayed, but without additional context, it's unclear what it refers to; it might be an invitation to play or score a goal, or part of a larger message or advertisement.",soccer_player_head.mp4
196fe16f-5c81-4797-bce8-9e528e672246,147,"In this image, a person is performing a football trick, known as 'heading' the ball, whereby they are using their head to keep the ball aloft or to direct it in a specific direction. The technique involves using the forehead, which is where the person appears to be aiming to contact the ball. The action captured is a common skill used in the sport of football (soccer) during a game for passing, scoring, or clearing the ball. The text ""score?"" superimposed on the image suggests that the moment may have been captured from a sports-related media content or advertisement that highlights elements of gameplay or skill.",soccer_player_head.mp4
ea83b588-0571-4a6a-859d-be9b86ec4277,151,"In this image, a person is balancing a soccer ball on the back of his neck, tilting his head back to keep the ball steady. His eyes are slightly crossed, possibly focusing on the ball or maintaining concentration. The person is wearing a red shirt, which appears to be damp, perhaps indicating physical exertion or that they are playing in wet conditions. The background is blurred, but it appears to be an outdoor setting, likely a soccer field given the context.",soccer_player_head.mp4
c95ad86c-524a-4eb4-9df9-4b4f2ce76a2d,155,"In this image, there is a person who appears to be performing a soccer trick known as 'heading' the ball, where they use their forehead to make contact with and control the movement of the soccer ball. The ball is balanced on the person's head, suggesting they might be demonstrating their ball control skills or just about to head the ball. The focus is primarily on the individual with the ball on his head, illustrating a skillful and common technique in the sport of soccer.",soccer_player_head.mp4
ddebaf0a-2449-46ee-a689-02a62e68a176,159,"In this image, a person is balancing a soccer ball on their head, demonstrating control and technique commonly practiced in soccer training and freestyle football. The focus is on the individual performing the skill, with the background blurred. The person is wearing a red shirt and appears to be on a soccer pitch or training ground.",soccer_player_head.mp4
f06fdc82-d503-423b-bede-21c249975c53,163,"In this image, we see a person seemingly practicing a soccer skill by balancing a soccer ball on his head. The person is tilting his head backward and looking upward while the ball is stationary on his forehead. His focus and control suggest that he is skilled at this, as keeping the ball balanced in this way requires good technique and stability. The background suggests this activity is taking place in an outdoor area, potentially a soccer field or training ground, given the seating visible which is reminiscent of stadium seating.",soccer_player_head.mp4
d599af50-134f-4c0f-bb60-da004c219723,167,"In this image, there is a person who appears to be performing a soccer trick by balancing a soccer ball on the back of his neck. The person is wearing a red shirt and is looking upwards towards the ball. The setting seems to be a sports venue, likely a soccer field, as indicated by the presence of stadium seating in the background. The focus is squarely on the skillful maneuver, showcasing the control and concentration required to balance the ball in this way.",soccer_player_head.mp4
396566ef-8f8c-4475-be40-20da06fb0f86,171,"In the image, there is a person practicing a soccer technique known as ""heading,"" where a player uses their head to play the ball. This is often done to control the ball when receiving high passes or to direct the ball towards the goal during a match. The individual is looking upwards and is positioned to strike or control the soccer ball with their forehead. The focus and athletic posture indicate a moment of training or play. The word ""Find"" overlaying the image suggests that the image might be part of an advertisement, application interface, or some motivational or instructional content.",soccer_player_head.mp4
a2f32bfc-1ea6-4ed7-a127-0d77835d1256,175,"In the image, there's a person balancing a soccer ball on the back of his neck. He appears to be tilted slightly backwards to maintain the ball's position, and his focus is directed towards the ball, indicating a level of concentration on the task. The word ""Find"" is overlaid on the image, but it seems unrelated to the activity being performed by the person. The image suggests a moment of skill and control typically associated with soccer or football freestyle maneuvers.",soccer_player_head.mp4
